{
  "$schema": "https://json-schema.org/draft/2020-12/schema",
  "$id": "https://optees.org/schemas/simulator/v1/replay_report.v1.json",
  "title": "ReplayReport",
  "description": "Report of an episode replay run comparing state hashes and recording overall replay fidelity.",
  "type": "object",
  "required": [
    "$type",
    "schema_version",
    "report_id",
    "original_run_id",
    "replay_mode",
    "executed_at",
    "overall_status",
    "rounds_evaluated",
    "matched_round_count",
    "diverged_round_count",
    "initial_state_hash_match",
    "final_state_hash_match",
    "divergence_report_ids"
  ],
  "additionalProperties": false,
  "properties": {
    "$type": {
      "type": "string",
      "const": "replay_report"
    },
    "schema_version": {
      "type": "string",
      "const": "1.0.0"
    },
    "report_id": {
      "type": "string",
      "pattern": "^rep-rep_[a-zA-Z0-9_-]+$"
    },
    "original_run_id": {
      "type": "string",
      "pattern": "^ep-run_[a-zA-Z0-9_-]+$"
    },
    "replay_mode": {
      "type": "string",
      "enum": [
        "RECORD_REPLAY",
        "DETERMINISTIC_RE_EXECUTION",
        "NUMERICAL_RE_EXECUTION"
      ]
    },
    "executed_at": {
      "type": "string",
      "pattern": "^\\d{4}-\\d{2}-\\d{2}T\\d{2}:\\d{2}:\\d{2}(\\.\\d+)?Z$"
    },
    "overall_status": {
      "type": "string",
      "enum": ["MATCH", "DIVERGED", "INCOMPATIBLE", "FAILED"]
    },
    "rounds_evaluated": {
      "type": "integer",
      "minimum": 0
    },
    "matched_round_count": {
      "type": "integer",
      "minimum": 0
    },
    "diverged_round_count": {
      "type": "integer",
      "minimum": 0
    },
    "initial_state_hash_match": {
      "type": "boolean"
    },
    "final_state_hash_match": {
      "type": "boolean"
    },
    "divergence_report_ids": {
      "type": "array",
      "items": {
        "type": "string",
        "pattern": "^div_[a-zA-Z0-9_-]+$"
      }
    }
  }
}
